Title,Lyrics
Narco True North,"1 ContributorNarco True North LyricsStill got one foot in the game can't Rap about my savage ways In the bando filling like Santa got Broski on the watch while am loading my bags We like mates in the cell how we breaking that bread Feeling like Shaka Zulu how am swinging that shag All of these rappers ain't posing a treat brought it to life cause this Rap game was dead Mountain man am a legion you can't compare me to pigeon Fly out the  night with a vision fell out the nest little pigeon I eat everything that is breathing Humble your self this ma season I'll swallow your gang like a whale eating fish in the ocean  Out of existence.... Your gang is my Bosta Hasta la vista ma nigga ME llevo a tu Chica Te amo Ragazza Three pm on N2 am still moving north where the cake is Baking chain is racking  Told my niggas i might jump out cause the margin In drilling and Rap is not equal when it comes out to the outcome Fell in love with the money machine all I heard is that money is a sin Left and right how am swinging the fin like a shark how am taking my cut  Blood diamonds how am leaving the scene you see me now you me never am blessed ,,,,In he'll and,,,,, Cursed in heaven You see:::: Me now you ;;;See me never am ,,,,Blessed in ahhh:::  [I can't complain real niggas say obey am in the studio getting baked Rap game is getting racked  Four wheels no brakes Review mirrors mirror am flashing lights pull upon you like a drag race No face no case !  I can't complain real niggas say obey am in the studio getting baked Rap game is getting racked Four wheels no brakes Review mirrors mirror am flashing lights pull upon you like a drag race No face no case !] You might also like  One men Ting am a ghetto mandem  never stopped cycling I don't know what its like to be chilled whilst this Rap is running Got five toes in this trap and am stuck like concrete I tried so hard like Bone Thugs in the studio feeling like Akon And this trap this game is mine your  favorite rapper what can they reckon No beef just a piece of beacon more bodies in a Rippers wagon got burnt down cause he feels like a champion Men like Ben Still move if men don't move is stressed kudos wanna talk about groove  They wanna know if men like Ben do get down when it's time to dance I might kick it like Matthew Lee, when I'm moving with Billie Jean  Had a word with a Bafo Maths ,woke up with a melody that's when I learnt to dance to pain Nine to five still stuck in my ways  They say men is moving nice that's how it looks when you dance with the devil in hell Got this thing in my head that talks you don't wanna know what it says If you see me shake my head alone that's  when I disagree to demons Got this thing in my head that talks you don't want to know what it says..  [Talks talks talks]  [I can't complain real niggas say obey am in the studio getting baked Rap game is getting racked Four wheels no brakes Review mirrors mirror am flashing lights pull upon you like a drag race No face no case ! I can't complain real niggas say obey am in the studio getting baked Rap game is getting racked Four wheels no brakes Review mirrors mirror am flashing lights pull upon you like a drag race No face no case !]Embed"
Og Clips,"1 ContributorOg Clips LyricsThis is for my niggas under roses who left with no goodbyes changed the scene with no no caution I hope you find peace and love all thr things you should have done let them go and rest with no tension Besides all the thugin you be one of the best cause people seem to judge who ever whether blessed or cursed I pour liquor for my niggas with a fist on my chest, even though we world's apart we be moaning like you here with us If it wasn't for the rules and staff I'll give half of what i have just to buy you days You believed in nine to five every men for him self but In the streets ypu rolled up cause you knew crime that pays I never saw you going fishing or with hooks and rods but one day you came home with many crabs in the battle and for the first time I saw somany Glocks and wheels with no cops _____________ [ Ma nigga say something You know this ain't part of the plan just say something All this diam ain't nothing if losing you was part of the plan this ain't mo deal Ma nigga say something Nigga ypu can't Die on my hands just say something Ma nigga say something You know this ain't part of the plan just say something All this diam ain't nothing if losing you was part of the plan this ain't mo deal _____________ Ma nigga say something Nigga ypu can't Die on my hands just say something Ma nigga say something you know this ain't part of the plan just say something  All this diam ain't nothing if losing you was part of the plan this ain't no deal] Ma nigga say something you know this ain't part of the plan just say something ] _______________  You my Day one nigga my Big bro my cuz if it wasn't for your lessons I'll be chopping these onions, but out here you left curbs we still hunting like lions all the niggas on your case ain't got no bed to go lay on ,you the reason. Why niggas found peace in these #### some of the niggas MIA when street watchers were talking  I saw your name on the news but the story was different haf to go and see the writer for some defaults and judgements When i got to the house the whole story was different, niggas wanna talk shit like they living on islands when it comes to touching blood I'll be causing the damage When i broke my bag for the family debts and bills you thr one who backed me up on the studio Money When you died I went and put the microphone in the back yard This line is for the boys in the hood we don't cry how I wish all of my niggas who died were locked up cause in the end they will get released we will rejoice and Mob ties You might also like _____________ [ Ma nigga say something You know this ain't part of the plan just say something All this diam ain't nothing if losing you was part of the plan this ain't mo deal Ma nigga say something Nigga ypu can't Die on my hands just say something Ma nigga say something You know this ain't part of the plan just say something All this diam ain't nothing if losing you was part of the plan this ain't mo deal _____________ Ma nigga say something Nigga ypu can't Die on my hands just say something Ma nigga say something you know this ain't part of the plan just say something  All this diam ain't nothing if losing you was part of the plan this ain't no deal] Ma nigga say something you know this ain't part of the plan just say something ] _______________Embed"
Popping Pills,"1 ContributorPopping Pills Lyrics[One Thing I learnt in life whether dark or blue you Rip what you saw Them men they see you coming they run towards you and close the door Heads or tails I asked my self ...are they really down for bru's How many times I was in a Hotspot charging lines for friend or Foes]   [One Thing I learnt in life whether dark or blue you Rip what you saw Them men they see you coming they run towards you and close the door Heads or tails I asked my self ...are they really down for bru's How many times I was in a Hotspot charging lines for friend or Foes]  How many men sleep under the bridge fell inlove with a smoking pipe back in the days they lost they grip, told my self I'm gone smoke this joint men like Ben Don't chase that high Seen some homies leave their homes with stolen goods and no good byes If you think one men is dirty dirty I'm one of the cleanest in my gang  All I know is chase that bag many men wanna sit and brag ,one thing is certain certain slow grind is better then none Went down on the busy road I've seen some niggas I grew up with their in and out like prison break When the real niggas ride out you know BigAre Ben the streets is done Got seven up for my Gs Got seven up for my mandem hustlers Got seven up for that good luck  Got seven up when you hitting that jackpot On the road with them hyenas I've seen some opps get eaten alive On the dark side of the town with the wrong colors in your bag this is 031 Most of the time the sky is blue and the sun is out ,most of the time the moon is red ,I don't know about sunset but still got my joint for the sunrise You might also like [One Thing I learnt in life whether dark or blue you Rip what you saw Them men they see you coming they run towards you and close the door Heads or tails I asked my self ...are they really down for bru's How many times I was in a Hotspot charging lines for friend or Foes]  [One Thing I learnt in life whether dark or blue you Rip what you saw Them men they see you coming they run towards you and close the door Heads or tails I asked my self ...are they really down for bru's How many times I was in a Hotspot charging lines for friend or Foes]  Am out on the road ducking and diving Big Men El_Chapo ,heard a quote that caught my eye it said as you live better count your blessings Where I'm from we barely smile for the love of God we don't call it a curse ,our pain is more like a lesson The rich gets richer and the poor gets poorer and the hustlers stay on the road can't sleep on the mission Let him who has no sin cast the first stone I'll be out here waiting They Don't care when you out here struggling when you paid they wanna know what's happening Is he really eating of raps or is he out there drilling with mandem I'm on the road from Am to sundown drop rhymes when I'm chilling eSnqawnqaw and I've said it before what you smoke don't make me choke, what you eat don't make me drop The girls I'm hitting now way better than your wifey. Am a grinding men I don't dig on the same trench  My dick still hard like a crow bar am stuck on that booty like Towbar Fell in love with her boobs she had no bra,are you leaving that i said no bru ,run for her booty like one of the snow bros Fell in love with the dark side of the moon, whether in or out the bucket you know every drop counts    [One Thing I learnt in life whether dark or blue you Rip what you saw Them men they see you coming they run towards you and close the door Heads or tails I asked my self ...are they really down for bru's How many times I was in a Hotspot charging lines for friend or Foes] [One Thing I learnt in life whether dark or blue you Rip what you saw Them men they see you coming they run towards you and close the door Heads or tails I asked my self ...are they really down for bru's How many times I was in a Hotspot charging lines for friend or Foes]Embed"
Real As it Ghetts,"1 ContributorReal As it Ghetts LyricsSo I tighten my shoes just incase we run sometimes am out the booth just to get shit done I might feel like am Arthur with the gun on my hand or be a man like biko with the brains in my head , I meant to live a long life like Madiba instead Some people hate to see you grow they only see your mistakes all the fakes all the lies be the reason am baked Visions of a grown man from day one of my Ps It ain't about who came first it's the Size of the cut this is as real as it gets now we raging the block, some of my opps throwing shade they ain't afraid of the glockenspiel Until an eye for an eye they ain't no story as such ninety minutes tucked in amo do it or die I know you niiggas want me dead I'm gone get to you first I swear you will never hear a word when am quenching my thirst When you running with my bread I'm gon come for your shelves don't be the type to call the cops on some robbery Theft Making last minute deals with the nine on your back Bitch we the same age who the fuck is your uncle  Ooh live your life [hey] Tryna hustle everyday seems like am going down I know life is hard but i rather go broke then go and make a sacrifice  I'll be a man and take a loss like am a boss and shit bit when am Don with what iam on iam all about that check Whether one two or three I still count that brick, niggas push me off the edge like I walk on walls, hood nigga being gentle that's a wake up call Iam in the space where they say you don't release you fall ,you niggas showing all the hate like I got gravity codes. Seeing niggas stay afloat is the reason you choke Maybe my hustle unmatched why they wait for the fall Showing me they last tooth with that fuck you face When you dive in the ocean beware of the sharks when thy see you freestyling they approach for a cut, I'll never sign men deal just to flex in the hood They Say iam for the moon miss be amongst the stars make it rain in the club i know you got that card  It's the good the ugly and the bad on my face who am I   Ooh live your life [hey] Tryna hustle everyday seems like am going down I know life is hard but i rather go broke then go and make a sacrifice As real as it's gets... I know we not the same /// Let's try and make a change Ohhhh uhhhh hooYou might also likeEmbed"
Roc Da Boat,"1 ContributorRoc Da Boat LyricsNiggas were jackaled in chains back in slavery days Couldn't even take a walk or go and chill at the bay We used to talk about death, rolling joints in the stu Most of my niggas bashed out for the nine to five  We out here breaking chain generational curses I don't blame you niggas, your success came early I fell in love with this rap before I got in the studio Most of you niggas are wack, your whole story is backwards  Old nigga on the gram, tryna cop this blue tig So the ladies on my slide, whether thick or slim I see the nyash , on my feed, thеn somebody's gon' get it Back in 006, I couldn't close my jaws  Looking at thеse hot women on my TV screen So I might cop a cougar or a milf for a Halloween theme Bad boy with a big broom, turning bad bitches to fly witches at night Beat that ass up, take a shower like a Zulu guy  And sing a lullaby, I'm on the street Chasing bitches, throwing signs for the rolling by's We out here tryna win, yo  Even though I handle biz, but I gotta find the pouch when I You might also likeI be feeling on your hair while I'm tapping on your ass, when I Shawty got a good smile, but I finna change that, cause I She want me too, she want me too, ah  Even though I handle biz, but I gotta find the pouch when I  I be feeling on your hair while I'm tapping on your ass, when I Shawty got a good smile, but I finna change that, cause I She want me too, she want me too, ah  BigAre Ben a pen too, vintage for y'all  If I buy that dress, she's the one who's gon' wear it I'm not that feminine, I know what's feminine I'd rather be a gentleman Opening doors and pulling chairs like a chauffeur  Giving the love that she don't get from his many men Grabbing my dick, she brings it up like a toaster Flipping it up, I pick it up from the sofa Spending my time with the bad girl with good head  Then fake niggas with low morals and bad vibes I got a glimpse of the good power I might paint the mural in a split second Taking my time with this tall girl with high niche I'm like David on the foreplay I ain't no fear, no giant Back that ass up in her heels Put your legs on my shoulders, I like how you smell  It's like a enzyme on my dick's drive, I'm still up I did maths as a young nigga MC's equal to women are hot in four corners Living the life from the east to the west  And the nyassh she's still the best in the southern side  Even though I handle biz, but I gotta find the pouch when I  I'll be feeling on your hair while I'm tapping on your ass, when I Shawty got a good smile, but I finna change that, cause I She want me too, she want me too, ah  Even though I handle biz, but I gotta find the pouch when I  I be feeling on your hair while I'm tapping on your ass, when I Shawty got a good smile, but I finna change that, cause I She want me too, she want me too, ahEmbed"
RRRR PAH,"1 ContributorRRRR PAH Lyrics[Hoodlum all you hear is... Thrrr pah! Young nigga went for bread but he got shot like... Thrrrr pah Fell inlove with the money an scheming but he got shot like... Thrrr Pah! If you stuck in the ghetto relay got to dodge that... There Pah ! ]  _____________________  I got to thank God for all these blessings and grace sometimes I feel numb on holy water I wash my face Cleaned all my sneakers for the feds I left no trace I'm just doing a home run Little homie this ain't your race I've been working for countless days If a hood nigga took flight Bru you don't know me don't judge my casе I've been working to pop that ace for the opps gеt out my face ""Mi casa Su Casa"" I grew in the murder scene sometimes the weed is my medicine Most of the time I look around I only got my self and I Why snitches tryna block my hand from riches you know I'm all about those bitches fat burgers and thick cheese, grown men I'm all about victories Came in the matrix dope twentyfour hours I'm causing glitches  _____________________ [Hoodlum all you hear is... Thrrr pah! Young nigga went for bread but he got shot like... Thrrrr pah Fell inlove with the money an scheming but he got shot like... Thrrr Pah! If you stuck in the ghetto relay got to dodge that... There Pah ! ] _______________ O nine I picked that pen o twelve I was with the gang bought more mics because I had more plans kick and snare and i made it work all of these bars are of the drain Seen some niggas leave this game I'll be here until I make it rain I'm in the studio casting spells when I'm asleep I'm hearing bells must be my spirits are outta Tune I'm on my daily Carpe diem playing chess with a cup of tea I've never been good at yelling check mate fuck around and watch your step P/A no warning shots, keep your head up and connect the dots I'm in the relay running Rap grabbed this mic from all of the goats K_B 37 -The Great one who comes after Al-Shakur and Al-Ali the most High One men thing on my wrist I ain't got time to fuck around and run for bate You might also like________________ [Hoodlum all you hear is... Thrrr pah! Young nigga went for bread but he got shot like... Thrrrr pah Fell inlove with the money an scheming but he got shot like... Thrrr Pah! If you stuck in the ghetto relay got to dodge that... There Pah ! ]  [Hoodlum all you hear is... Thrrr pah! Young nigga went for bread but he got shot like... Thrrrr pah Fell inlove with the money an scheming but he got shot like... Thrrr Pah! If you stuck in the ghetto relay got to dodge that... Thrrr Pah ! ]Embed"
Shake Dat,"1 ContributorShake Dat Lyrics[Hey Mami Show me what you got ... When you drop that back I like that When you shake that ass I like that Move Back, Get Down, Pick it Up ... Come show me what you got I like that ]  [Hey Mami Show me what you got ... When you drop that back I like that When you shake that ass I like that Move Back, Get Down, Pick it Up ... Come show me what you got I like that ]  _________<<<<____< I ain't tryna cough Bad girl pretty no Voice Ain't got claws just tryna hit them pussy Kid got sauce said she inlove with my voice Dark skinned tone we ain't even gone force (Shake that ,move that ,bounce that, Toss that, I love it when you bounce and toss that, let me go down town and lick there.x2) (Body so curvy touch your toes you sexy You ain't got to ask me if it's money you want come get it.x2) [Hey Mami Show me what you got ... When you drop that back I like that When you shake that ass I like that Move Back, Get Down, Pick it Up ... Come show me what you got I like that ] You might also like[Hey Mami Show me what you got ... When you drop that back I like that When you shake that ass I like that Move Back, Get Down, Pick it Up ... Come show me what you got I like that ]  ///______________ Unokuyi Wisa aphindayi coshe ayibuka, phindayi khothe, ayibambe aybeke khanda ibeke libeke aphinde ayidonse Young Ma unokuyi shova name kasi uphethi nkotha Clock wise useroundini uraise flag uphethi sthixo Eish kudos nome steady iAss busy traffick cop up and down patience slippery curves big booty and thighs Tshupi Ramels, spread it like that coz you smell nice is you gotta a coochie that smells nice !?! I might wanna know I might be nasty feeling like Byron long , my Dick Still hard like Hand brake part two might take two lon I like how you throw it down choking on it like you pulling a Bong, Don't make me wait to long  ______________________ [Hey Mami Show me what you got ... When you drop that back I like that When you shake that ass I like that Move Back, Get Down, Pick it Up ... Come show me what you got I like that ]  [Hey Mami Show me what you got ... When you drop that back I like that When you shake that ass I like that Move Back, Get Down, Pick it Up ... Come show me what you got I like that ]Embed"
The Story Is Different,"1 ContributorThe Story Is Different LyricsThe story is Different it takes more muscles to Fraun than to jump on your face and beat it nah get on the road and kick it I mean jump on the booth and spit it  The story is different Between homies and a chain and neighbour's homies are the niggas you grew up with day ones the things you can't change and neighbours are the ones you see at funerals and sometimes in clubs and a chain is the niggas you hustle with a stop sign is a nine to five you break my link I jump on set I don't know who bangs.. See the story is different If you don't ride don't drill don't cook don't bakе don't hustle then my nigga you hanging with neighbour's  Still in thе trap like Denzel on the mic I got the blue magic ,one men Ting on the rise still one on the Ps that am Racking  Still trapped in the mountains try again later if my line is breaking some days men got to chose you taking the box or you paying the price jump in the back or you get in the cell talk on the low or you leaving the bag See the story is different Two Births unders one Son like the story of Abel and Kyle's [The story is Different]  [Online his a loving men his out there helping swipping serving That men has TlC his a very loving men but in Real life the story is Different... That men a beast a boar he runs like a wild dog he got Makhaya Ntini swing.]  Online his a loving men his out there helping swipping serving That men has TlC his a very loving men but in Real life the story is Different... That men a beast a boar he runs like a wild dog he got Makhaya Ntini swing.]   See the story is different the things you see online the fancy cars and flashy things Come I'll show you how but in real life the niggas are broke hardship misery stress men can't even afford a smoke See the story is different see them kudos hot nice ass cute face baby girl I like your curves but we jump on bed it's missing,,, See the story is different In Your hood you'll be buying water in my hood there's no bread no money for paying rent still making moves in the trap sliding coins in my Pig See the story is different If I show you respect pick a six for your grind some how you think that iam weak that's when iam raising a boogie feeling like John Wick  Hump on the fone and link up On blood the story is Different Iam Breaking the maze like Thomas Running the Track like Hussain Still turn on the field like Dhino Got ten on my back like Messi Seven on my back like CR got Dirty Boots like Beckham iam Changing the game like Pep You might also like[Online his a loving men his out there helping swipping serving That men has TlC his a very loving men but in Real life the story is Different... That men a beast a boar he runs like a wild dog he got Makhaya Ntini swing.]  ///What you smoke don't make me choke What you drink don't make me sleep What you eat don't make me drop nigga watch how you approaching me ///  ///What you smoke don't make me choke What you drink don't make me sleep What you eat don't make me drop nigga watch how you approaching me ///    Online his a loving men his out there helping swipping serving That men has TlC his a very loving men but in Real life the story is Different... That men a beast a boar he runs like a wild dog he got Makhaya Ntini swing.]Embed"
