Title,Lyrics
Clean $ Money,"1 ContributorClean $ Money Lyrics[Sisebenza kanzima sfuni Mali Nomubani evuka ucabangi Mali Baba baxolele mabenga gcwali Kade siwa sivuka sfuni Mali...]  [Sisebenza kanzima sfuni Mali Nomubani evuka ucabangi Mali Baba baxolele mabenga gcwali Kade siwa sivuka sfuni Mali...]  ______________  Ngosakhona ngiyazi akulula ukungibona everyday ngikhlulazi Dollar, sfudumale siyekuku godola uyaze kasi sihlezi sithola Angifuni mali yegazi. Ngiya khlulaza mina magazi Kuhlangane ubukhlansi ngithole nobutladzi Lento sayiqala besaba bashana sayishaya bakhala baqala bagcwala Ukuthi uyangazi my brother bhatala Goloza ngiya gadla ngeke ngadlala abafana ngimdala ngisebenza ngiyazi khandla Nkulunkulu mkhulu uhleze namandla  Imali ngiyayi dinga sdingu Madiba irep lezo iqeduku shizila. Lento ngiyayi feeler Ikhali ngiyazi cija mangifika bayobe bevika ndonga dilika kudala sishizilwa ikasi lonke kodwa asaziwa Ngihlaba ngiya hlinza kukhala mabhinca ngikasi ngiyaba shibiza Ngifunu Madiba angithuya ngizwa hey ngifunu madiba  [Sisebеnza kanzima sfuni Mali Nomubani evuka ucabangi Mali Baba baxolele mabеnga gcwali Kade siwa sivuka sfuni Mali...] You might also like[Sisebenza kanzima sfuni Mali Nomubani evuka ucabangi Mali Baba baxolele mabenga gcwali Kade siwa sivuka sfuni Mali...]   Red door oh gold umlando ka ngelekejane nonongoloza uyazi phinda zisezi ntabeni izazi ziyagqoma, imale clean kuqhashama dollar Izithupha nuz vele ziclean koPetori fede bang seba ofakazi vele bamlophe, zulayini scrossama boarder part time splacer ama order Ksayi One Men Ting On The Run kdala sgudla ksalama doda drip to hard imsebe yelanga nomakunga nethi uzoyi phathi umbrella Kule game ngifanano Casta blood line bafunu kuyi hlola sure case akunanje zongi mela Ngisayi shova nge pedal eyodwa namanje bafunukung testa leyo game ntwani zoku costa Kudala sishova nge 0 3 1 sfakama link kphelama data sarepha ksangena wifi Sineyi male stuck online senza kakhulu bakhethu kuscrossa So sometimes kushama gqosha Kule game iminoyi Ank ngenza kakhulu ngi under ground Flow yam ngeke bayimele Compare ulwandle ne water can lana emashayo iphindi shayise Ukhethi Mali nomi bookish Udobhi sbhamu nomi bhayibheli  [Sisebenza kanzima sfuni Mali Nomubani evuka ucabangi Mali Baba baxolele mabenga gcwali Kade siwa sivuka sfuni Mali...]  [Sisebenza kanzima sfuni Mali Nomubani evuka ucabangi Mali Baba baxolele mabenga gcwali Kade siwa sivuka sfuni Mali...]Embed"
Deep Breaths,"1 ContributorDeep Breaths LyricsAll I want is deep breaths how Come am still awake from last night I couldn't sleep ,visions of my life and memories got me digesting grass at night like sheep I smoked twelve joints today god damn I hate growth got me dodging all this pain to my head like am Mayweather the goat I grew up dead bodies at my back yard done better than the Mexican way ,six am I asked my Big bro do you wanna see dead bodies he thought it's a prank I was to young for such if my nigga said I didn't see nothing then I didn't see nothing  A Bunch of OG at my front door smelling like grass, who ME I didn't see no thing ,police showing up high Mr nice lights but I still didn't see nothing Relocated to the hostels and I saw worse ,evеry Mondays ma school shoes were full of blood  I'll nеver be obsessed with the red bottoms my whole hood is dangerous, you can walk in my shoes I give you that I'll be at the Bay bare feet tryna catch these deep breathes like am Nietzsche    We went to the shop came back the OG was shot dead took the Drinks for our selfs even though we were to young for high shelves I was lost as kid and for the first and last i failed a school full year on my school grades, kids wearing white tops young Ben is sky Blue from knee high to T shirt. Feeling like a black sheep I got involved in somany fights and I grew claws another bear in a sheep skin ma nigga say what ? Hostile life hot women taking showers in public toilet with no doors young niggas passing by peeping flesh  I guess it's how I fell in love with Nyash and thighs Five pm at Grounds with the Nazareths blowing natural horns And stomping grounds am on time for the sunsets and deep breathes Half of my younger days were like a run in the apocalypto I almost drowned I almost got hit by a miss fire I almost got chopped up for voodoo spells and black magic I almost got hit by a drunk driver playing hide and seek in the projects  I almost fell in love with the crack and never came back Thank God for hiphop Started out in the heart before we went to the park  You might also likeTo many almosts I bet you almost passed this song on your doubts on a grown boy and I thank God I almost never picked up the pen but i did in ""o"" nine I dropped my first verse with no mics or Rap plugs nor friends Still looking for these deep breathes with no ends I got exposed to the game at the bat in O10 ,but I was at the back painting pictures of freedom fighters and last kings in our tribes Two years later am back with my niggas its the Comg style we in charge of the game , careers died my niggas dropped a diss that the Rap game will never forget Things that I did with the gang were never meant for the record but since these niggas getting paid of the things that we do in Real life Iam on point with the drills am just behind in the game it's to bright I got inspired by metaphors and Punchlines most of these rappers got inspired by adlips and autotune switches, my verse so good got you confused like the death of Pac or George FloydEmbed"
Ekasi Drill,"1 ContributorEkasi Drill Lyrics[From tripple Fives pallet guns Besisa intwana... Olova bedlali bhamu ! Namanje mawufike kasi anthem... Olova beslali bhamu ! Nine one one umakhelwane uya complainer, outside... Ngolova badlali bhamu ! Mayisuka ayisuke, istraadi sncane mabonwa bulawe, ngzok thola sodlali bhamu.]   [From tripple Fives pallet guns Besisa intwana... Olova bedlali bhamu ! Namanje mawufike kasi anthem... Olova beslali bhamu ! Nine one one umakhelwane uya complainer, outside... Ngolova badlali bhamu ! Mayisuka ayisuke, istraadi sncane mabonwa bulawe, ngzok thola sodlali bhamu.]  Code ten intwane ukhulelе kasi sonke siyamazi uzincanyelwa idisc ashayi ngane part timе ablome nes'out Uthando luyi risk bhudas imshiye nokhiye Day time aziphathelu queen ashongo one mayiqeda bheke phezulu,kufike ama outy Eyodwa inokhe ngesdunu isho ngo one, Bru wami uhlabi ntombi yami Code ten ahlanye ,droweni ibhuda inempompo acheck bible Anthem one uyanyuka kuncinza iskobho,,, eh son ngizokwenzi sobho ikhale windini Code ten adedelu fire Statham kujumper ma outy Gatin agcwali straadi mabonwa bulawe iterrytorry yakhe Mayiphuma ukhipha poison imagazini kseli dozen lama outy awaxinu bumper afice yodwa isale brijin You might also like  [From tripple Fives pallet guns Besisa intwana... Olova bedlali bhamu ! Namanje mawufike kasi anthem... Olova beslali bhamu ! Nine one one umakhelwane uya complainer, outside... Ngolova badlali bhamu ! Mayisuka ayisuke, istraadi sncane mabonwa bulawe, ngzok thola sodlali bhamu.]  [From tripple Fives pallet guns Besisa intwana... Olova bedlali bhamu ! Namanje mawufike kasi anthem... Olova beslali bhamu ! Nine one one umakhelwane uya complainer, outside... Ngolova badlali bhamu ! Mayisuka ayisuke, istraadi sncane mabonwa bulawe, ngzok thola sodlali bhamu.]  Gcwali bhobhini elikabuana useroundini useya phanta tension wok qala kushi mpama Blomas nama razo kuhlangenu grey nongelekejane Ama pitbull ekasi aqaqiwe kuhlangenu kubhuzi nkanyezi edale sgqonqeni Thuluzi rubber velu kshayisene zine ntabeni ezazi ziyagqoma nge Diamani kufama outy Kutym kdawanu mkhosi khlangani plani Ma outy khoni saka eliwu sure case mawukuthi singayi shova Ngelekejane akhiphe iskhwama avezi bhamu Maphanta egcweli kari mission usuhlangene ilocation vele siphethe Gazoli igcweli drum cash up Cesar Sdala abasdalayo Gedlela liphuma kolayini ma outy engena ejaivini gcwala kubhuzi nkanyezi Ma outy esale dustin ikasi likhala kusali thixo ovulavala noma kuvaliwe mabonwa bulawe umehle bamba..   [From tripple Fives pallet guns Besisa intwana... Olova bedlali bhamu ! Namanje mawufike kasi anthem... Olova beslali bhamu ! Nine one one umakhelwane uya complainer, outside... Ngolova badlali bhamu ! Mayisuka ayisuke, istraadi sncane mabonwa bulawe, ngzok thola sodlali bhamu.]   [From tripple Fives pallet guns Besisa intwana... Olova bedlali bhamu ! Namanje mawufike kasi anthem... Olova beslali bhamu ! Nine one one umakhelwane uya complainer, outside... Ngolova badlali bhamu ! Mayisuka ayisuke, istraadi sncane mabonwa bulawe, ngzok thola sodlali bhamu.]Embed"
Get Are Way,"1 ContributorGet Are Way LyricsReal niggas are still alive they just hide in the crowd when young niggas cup their bags they'll be cheering and proud We ate from the same bowl we were raised like we cubs, most of my OGs dark side they don’t fuck with the cups Broke niggas get they bags when they snitch on thugs, Men had to take a break from fake peers and fake hugs If you ain't drinking profit you at the counter you and your niggas over prices checking your pocket Phoney niggas playing dead like thеre is mo service, lеt your homies take losses with no ceilings Why these niggas showing hands if they not helping, they want a piece of every slice when you gone fishing Cheers to the bench squad I'll be still running ,niggas waited on my fall ended on my wave taking shorts on the low cause they still trying When the karma hits you back niggas practice what you preach  _____________ [I’ve been tryna get away From all these niggas who be hating on a low key yeah ! I'm just tryna catch a break I keep my head to the sky cause they don't mean shit.]  [I've been tryna get away From all these niggas who be hating on a low key yeah ! I'm just tryna catch a break I keep my head to the sky cause they don't mean shit.] _________  Men took Jabs and found peace and graph but on the low still worried about they health and stuff, we laugh about it over drinks rolling blunts at night but my niggas been aware all that shit hits deep It's the control system makes you more less of a men ,you niggas got convinced I'm to grown for that Living wild take one for the boys but every men wants a place called home when the calendar hits Some niggas saw the BigAre picture but they fell for the tricks If my opps throw one than iam throwing a six You homies still throwing stones like we got no bricks if some how you bring beef than am greasing the coals Don’t let your life be another niggas short term goal If many men already fell why they drag us along if ten niggas say you lame then you’re where you belong Somehow you got to take a break just to show self love You might also like[I've been tryna get away From all these niggas who be hating on a low key yeah ! I’m just tryna catch a break I keep my head to the sky cause they don't mean shit.]  [I've been tryna get away From all these niggas who be hating on a low key yeah ! I'm just tryna catch a break I keep my head to the sky cause they don’t mean shit.]Embed"
God Father III,"1 ContributorGod Father III Lyrics[Verse one] Back to reality I study the maze like Vasco I'm a sailing men I'm an pirate Some niggas got selfish egos now I live for the trap on the daily I swear to God iam tired of hood rats they came around and bit my sneakers Used to show my hand with gestures but I see no signs of life here I guess Iam showing these signs to mannequins I had to sit and wet my fingers now Ching sign is the only gesture I throw it out they still don't get it I carry on just stretching these bands men And I put in work back on my chair like bhuda One men thing no flеx bars ma Rap life is on true story , I ain't no fucked up Nigga bеing told what to do as write more of history , I looked around Connected the dots and found my name in his story I had to sit down and tell my story, iam a praying men with a burning shrine Like Chulos and Amigos I carry body raps for offerings and more rain ma essays got more bodies Then mortuary is These Days I'm just casting spells and obituaries They said Rap is dead, I said nah they gave the mic to Anubis  [ Chorus ] [ I Told you little niggas I'm your God father ! I am Your God Father ! I'm your God father ! (I am Your pap son !.) When it comes to this Rap and on earth (And on earth) I'm your God father ! I am Your God Father ! (Iam Your Pap son) ]  [ I Told you little niggas I'm your God father ! I am Your God Father ! I'm your God father ! (I am Your pap son !.) When it comes to this Rap and on earth (And on earth) I'm your God father ! I am Your God Father ! (Iam Your Pap son) ] You might also like[Verse two]  Family guy ,Business men entrepreneur with no Degree I do tomuch for one Guy I need extra arms like shiva Iam a God father on earth I know what to do next from birth Where I'm from it's gold or silver men die over Shiney metals My love for jewellery was more like Gansta then love for filigree, now Custom rings weigh more then fifty back then we used to do hollow and Platings I woke up from a different dream some things I hoped to forget buy yah Know that men don't cry, I took a knee and caught a breath Lately I party hard kicked it until I forgot my name algahul only brought me Pain Took a shot trip to the bandos extended my horn for three lines on the table Iam Ganesha I'm a Vacuum  [ Chorus ] [ I Told you little niggas I'm your God father ! I am Your God Father ! I'm your God father ! (I am Your pap son !.) When it comes to this Rap and on earth (And on earth) I'm your God father ! I am Your God Father ! (Iam Your Pap son) ]  [ I Told you little niggas I'm your God father ! I am Your God Father ! I'm your God father ! (I am Your pap son !.) When it comes to this Rap and on earth (And on earth) I'm your God father ! I am Your God Father ! (Iam Your Pap son) ]Embed"
Good Hair Natty,"1 ContributorGood Hair Natty LyricsThere are 75,000 Rastamen in Jamaica, they're easily recognised They don't cut their hair and wear it in long pigtails called dreadlocks They all say their religions and worship the dead emperor of Abyssinia, Haile Selassie, as Jah, God And through their marijuana haze, they dream of going back to Africa  I'm too obsessed with good hair, never got use to haircuts Barbers gone work on my edges, then I'm trimming my moustache TSA, TSA, TSA, spray that thing and go tsa-tsa-tsa Front line, front line, front line, cut that thing and makе it sharp, sharp, sharp  When I'm sitting in the bus, pleasе don't scratch my fade Please don't touch my afro, of course don't badge my fade Lil homie, better watch your hands Lil homie, better watch your step  I'm too obsessed with good hair I might get a fade like Martin Luther or Malcolm Maybe komb my afro like Biko or Hanni I have a dream to grow my dreadlocks longer than Damian Marley  And the lions of Tuff-gong, I got love for good hair I want a girl that looks like Angela Davis or Lupita Nyong'o Shiny hair like night skies On her head, she carrying the galaxy  I like good black hair like panther I'mma say that loud like Newton Good black hair like panther I'mma say that loud like Newton You might also likeI got good hair like Malcolm I got good hair like Nelson Good good hair like Marley Natty be dread like Rasta  Round black hair like Naza Black good hair like panther I'mma say that loud like Newton I'mma say that loud like Malcolm  I got good hair like Malcolm I got good hair like Nelson Good good hair like Marley Natty be dread like Rasta  Round black hair like Naza Black good hair like panther I'mma say that loud like Newton I'mma say that loud like Malcolm  I just need to be born again Would I have to be black Do you have a choice If you have a choice, you better be black if you have a choiceEmbed"
Grown Up,"1 ContributorGrown Up LyricsComing from the ghettos had to learn to keep my head up starring at the sky stars falling every hour like pop corns out the pot and a bunch of business men using that to gain power If The ones who run the world are deceivers and Liars then I understand why there is still debates about flat earth or spheres According to Ini I never saw proof of any sphere and what I know is what goes up will always find a way to come down, judging from my life I kept my head up and I always find a way to calm down The only time iam pissed is when I can't provide if I made anybody from any race wrong,,, its business No xenophobia and shit Whether you white or you black if you fuck with my bag you should pray for my fall I'll put your head on a bounty I got hood kids who will pop an opp for less than ten k  [I've been away hustlin it out am getting Ps now  Get these niggas out of my way am taking clips now  I'll come around Flashing that Canon I want my Bricks down I'll come around flashing that Canon I want my bricks down.]  [I've been away hustlin it out am getting Ps now  Get these niggas out of my way am taking clips now  I'll come around Flashing that Canon I want my Bricks down I'll come around flashing that Canon I want my bricks down.]  This is real life my niggas found sleep and never woke up, tomany blood clots most of the time I lost focus My mother playing lotto from her nine to five tryna change a family photo from a eight to five That's the life that we live in the sunny south most of the leaders who die are always striving for progress they get pushed to a side somebody sent him a shooter he died on his gate after a walk from a mall On my life's shift am doing this Rap as a lyrical genius I got young niggas looking up to me to see if rhythm and poetry is really worthy it or niggas go down the same bar and they carry Glocks on grams to be perceived as gangsta Some people push you enough to skiii down and fall business giving contracts ain't no retirement plan They vocab is full of hate it's all chorded in their words I had to keep the smile through the bullshit You might also like [I've been away hustlin it out am getting Ps now  Get these niggas out of my way am taking clips now  I'll come around Flashing that Canon I want my Bricks down I'll come around flashing that Canon I want my bricks down.]  [I've been away hustlin it out am getting Ps now  Get these niggas out of my way am taking clips now  I'll come around Flashing that Canon I want my Bricks down I'll come around flashing that Canon I want my bricks down.]Embed"
[ HANDY MAN DIY],"1 Contributor[ HANDY MAN DIY] Lyrics[Bad girls with juicy butt ! Why they calling a Handy Man , this must be a beta house I feel like a candy man I'm sprung I heard my business phone beep now my pants is all ripped damn juicy all drip! drip! drip!]  [Bad girls with juicy butt ! Why they calling a Handy Man , this must be a beta house I feel like a candy man I'm sprung I heard my business phone beep now my pants is all ripped damn juicy all drip! drip! drip!] __________________________  On DIY I'm nine one one am on time gotta catch that drip Private bag or private time day or night gotta make that trip Tap dripping sink is dripping pipe is licking Oh shit look how I flip the switch, I squeeze it like vice grip, she calling the handy men I heard my business phone beep Same number same door so first iam hitting my Bong rip ,I hope she got no hood rats  So amo put in work if shе calling put in work when I get therе N/A put that thing on vibrate Flip and turn it like hand brake air bags all over my face Most of the time iam tryna focus iam a men child, to good with my hands like Stevie Handy Man Or Candy Man I Also Wonder _________________________ [Bad girls with juicy butt ! Why they calling a Handy Man , this must be a beta house I feel like a candy man I'm sprung I heard my business phone beep now my pants is all ripped damn juicy all drip! drip! drip!]  [Bad girls with juicy butt ! Why they calling a Handy Man , this must be a beta house I feel like a candy man I'm sprung I heard my business phone beep now my pants is all ripped damn juicy all drip! drip! drip!] You might also like__________________________ Iam straight splitting the doors apart I'm street kid on groceries tomany apples around my dick now all iam doing is rubbery Sure good with the drill Ting I'm drilling the whole house and I'm leaving them dead like robbery Iam just a good men on my DIY and I take that ""complements"" for a better word of mouth I'm in the house with yellow Butt I feel like the living Simpsons I squeezed it hard and bust a nut must be the geezer burning hot Amo fix that like that Niger guy, I'm on DIY and all sorts I fixed I fixes that TV Fixed that back light Now I'm filling her disc drive with yoga and stuff then I'm done She wanna know if men is hungry next thing she offer cookies All iam seeing is Shiney booty oh shit Candy Men ______________________ [Bad girls with juicy butt ! Why they calling a Handy Man , this must be a beta house I feel like a candy man I'm sprung I heard my business phone beep now my pants is all ripped damn juicy all drip! drip! drip!]  [Bad girls with juicy butt ! Why they calling a Handy Man , this must be a beta house I feel like a candy man I'm sprung I heard my business phone beep now my pants is all ripped damn juicy all drip! drip! drip!]Embed"
Mrs Junes,"1 ContributorMrs Junes LyricsMeanwhile I'm back home with my mistress Smoking indoor while am tryna get ma head rest Every time you come around I got no stress you know I like it more when the booty shake with no dress I got love for cute eyes and fine skin Bring it over now watch me go waist deep Cause NO Woman no Ahhh when the sun is gone You know I slide through that thing until the sunrise Got me up pulling strings on the day shift  You know Falling of your back is the right clif Got me chopping on that cake like a French chef, watch me go up down like a bеnch press I can pick you up we can get off thе mattress DIY with Ben I Fix Everything Still Got no beef for men I took the chick'n I got you so close I can feel your heart beaten  [ I've been down I've been Round Baby!] We've been down in a minute...[Baby!] I got you in my arms in a init......[Baby!] We don't stop init ?! ...[Baby!] We go round and round init ?! ...[Baby!]  [ I've been down I've been Round Baby!] We've been down in a minute...[Baby!] I got you in my arms in a init......[Baby!] We don't stop init ?! ...[Baby!] We go round and round init ?! ...[Baby!] You might also like ""Energy"" I got energy I'll give you good loving whilst making good memories got you in my arms like a Spanish guitar when you done on your hair I finna get back to you Come over baby you can show me what you got you my ride or die like Bonnie and Clyde Got my head in your clouds never been loud everytime I'm with you I'll be living of the grid and when we move around I can never lose the grip You'll be still around when am feeling down and you'll be still here when am feeling up Cause you got that one thing that makes men stay of the streets spreading it all on the sheets getting me off my feet playing that one string I cutting you like a G string I like music I fuck through it but pussy so good it can make me lose conscious  [ I've been down I've been Round Baby!] We've been down in a minute...[Baby!] I got you in my arms in a init......[Baby!] We don't stop init ?! ...[Baby!] We go round and round init ?! ...[Baby!]  [ I've been down I've been Round Baby!] We've been down in a minute...[Baby!] I got you in my arms in a init......[Baby!] We don't stop init ?! ...[Baby!] We go round and round init ?! ...[Baby!]   See when the sun is down you know the streets is watching see when you move fast you hear the dogs are bucking but I'll be still around coz my moves are classic and I got that hot thing on the road she busting never need a bitch she be on in like a stunner , if am caught of guard she can pull up like a gunner we been Vibing all year Like everyday is still summer and when am on your back marathon am a runner one men Ting on that one men string never beg for love when you got men like Ben Nah they ain't like us they ain't got mind like men nah they ain't like us they got mind like.... [ all I need that's all I need] x3Embed"
